Response ID,Q7_Response,Category
R_1ifEIt6S98Rj7sC,No I don't think it's very feasible. Every classroom would have to have a robot. Where they already have screens which is easier to boot up and watch. ,negative
R_5v0JfEUOuMud7ph,"Maybe in the narrow sense in which it might improve over-the-board chess, but screen-based computers will likely still be the best way to do things, as they don't have the added latency of physically moving pieces.",neutral
R_2gBgh1zh135ctbV,No screen based are far more convenient and take up far less room.,negative
R_8OTLMh8JaB0XjD6,"Yes they could replace screen based computers. It's more engaging playing with the robot on a physical board, rather than screen based ",positive
R_2lbJ7Wy3nGLbmMn,"definitely, if the robots are skilled up knowing the most common chess algorithms to win it'll be harder for opponents to win",positive
R_2ONlD0oX7HFe8qP,Yes - I see nothing the screen based computers are doing that this is not.,positive
R_1JbaXDoxh6AKNVZ,"I think robots will take over just about everything and replace us with robots, which could be good and in other ways bad for us, because we will depend on them to much.",neutral
R_6AGwkQ7YF8QddUu,"I think it could be used as a replacement but I don't think it would completely replace screen-based computers. However, the price might be too high to replace screen-based computers completely. ",neutral
R_2CDu3O8TwNgAheP,Potentially because it feels more like a real player in front of you and it offers you a chance to practise skills. ,positive
R_3irIMsWwCExz0W2,Maybe not a total replacement. But it could be a significant tool. The robot is pretty expensive and takes up a lot of space. Screen-based computers serve many functions. The robot would need to have more uses.,neutral
R_1disSmMcyIcETHQ,"Yes. I believe this robot does a much better job of showing the chess strategies in a 3D space, rather than in a 2D board on a computer screen. Seeing the chess strategies in a real environment in my opinion is more effective on teaching children how to recognize chess strategies while also learning new ones. Lastly, the robot is almost like having a real teacher in the room, which I believe is vastly superior for a learning experience instead of having the children listen to computer audio while staring at a computer screen. ",positive
R_8SqOEs0sfvBDoQH,"no, I think screen based chess is faster and more accurate currently and also preferred by players.",negative
R_8NrAAq2xt9ZyWeZ,Yes I do. The robot provides good explanations for each move and can be used to improve and teach chess skills.,positive
R_2CQaCP9aQjaKAaK,I think it could definitely replace those services as it likely gives similar information but presents it in an easier to understand way as the person learning is able to see the movements in real life. The cost could be a prohibitive factor in replacing pre-existing services as a physical object like this would be far more expensive.,positive
R_8gBJsRLGo7bkr85,"Potentially they will work for some people but like all learning, people earn in different ways ",neutral
R_54fayvdTk11jPoy,"I?m not sure, I don?t know enough about chess",neutral
R_2q8KRW6z4U8rM1K,"Yes, in theory, although I find it unlikely that the average person would be able to afford one and/or have the requisite space + power + computing requirements to have one in their home. For personal use I would presume screen-based computers would largely remain. Additionally, having a loudly talking robot seems a little unnecessary for teaching chess and may not be desirable in situations where more private/individual study is required (or simply desired). ",neutral
R_6VrDez8DDOBSmn7,I think in certain places yes. Like research fields and for specific learning but I dont think itll replace the every day computers we use now. ,neutral
R_80o8rchxJlxKx5n,"I think they can supplement chess learning, but I don't think they will replace screen based computers as they are not as accessible.",negative
R_8CeSUPSYbb9U5QC,"Yes I can see their use in 10 years to replace screens, maybe sooner it technology allows",positive
R_1FkyHNKN4Hjm8SS,"I thinks so. They can learn which part people may have hard time to understand, so they can explain more specifically.",positive
R_3fxUWqRawVA6DVT,I think so. It is more interactive.,positive
R_1owmEbks7QItSX2,"Yes, because this is much more immersive (three dimensions!) than a computer screen.",positive
R_8lMc7B8tRApNRD3,Maybe - I think it could help some learners who are more practical and tactile learners.,neutral
R_2dHaUnJWcXC3105,"I think this could be an option however, a simple program can probably teach the same things while being far less expensive and more accessible to most.",neutral
R_2k1FWeKstaYwmwO,"It's fine, but surely a screen-based system would be cheaper and able to be implemented much more widely. It's nice as a demo item, but not practical.",negative
R_8KSByQ7nj4nX4UH,"This is possible as they may give a more 'hands-on' learning experience. But the cost of such a robot would be expensive compared with the costs of running computer based programmes, so I'm not sure many chess teachers would support their widespread use.",neutral
R_8PfmdhsLNU2Waqd,"Yes, I believe with machine learning robots could absolutely serve as a replacement ",positive
R_5170IxzMVySbbfY,"While possible, due to a robot having a physical interaction, thus making it likely more engaging than a screen-based computer, it would still lack the play speed of a screen-based computer as well as wouldn't be able to visually display arrows and variations as effectively, while also probably being a much higher cost to produce and implement than screen-based computers.",negative
R_1mygiVnsvnfzYBG,I don't think they can serve as a replacement unless big improvements are made.  The robots are not very human like.,negative
R_2dF4Sd87lNBrRuZ,"Potentially yes, if they were to explain how and why they?re making the moves they are doing",positive
R_5m2MSvphjNA0vfj,"Yes, it?s visually appealing ",positive
R_2PU0e4rqsrlKK9H,"Absolutely, sometimes it?s not as easy being on a computer but physically seeing a robot move and why it?s moving there I think is brilliant ",positive
R_2arj0nNO9q5nguw,Possibly but I can't see there being too much value added here unless it's more reactive,neutral
R_8bV30ixbJwGcVPv,"Yes, perhaps so, particularly if the robot is a little livelier. I think the use of something physical can help people to engage all the more. If it's a robot like this that can point out a method via actual movement of the pieces on a 3D board rather than just something someone is interacting with on-screen. That said, I can imagine that the latter would be sufficient for some users. Particularly those who've played a fair bit of chess already and want a speedier way of observing/learning. I imagine with the AI use, one could also ask the robot to show something again/differently/or ask a question about one of the methods discussed.",positive
R_3YKYRTAAudWRaH3,Nothing at all............,negative
R_3neKTqklEw8077r,"Yes, it could happen, as it could serve as another player or some type of tutor, someone you can learn from playing, which you can't really replicate or do in the same way on screen-based computers.",positive
R_2CAXvOZclUnhkg5,"No. Not a replacement. Robots could be another source of learning but they will not replace screeen based systems because they are not easily portable and they are likely to be expensive. A simple screen based system, even an app, is cheap and convenient.",negative
R_8Lil2JAe65ofPka,Yes! this is much more visual and realistic!,positive
R_2FkMa3exvAElUQb,"Again, I think the expense is far to high for a simple game procedure.",negative
R_8THGToN58NR6pBU,"Yes, If there's an improvement over time. ",positive
R_4NvNuKocRkisW9K,"I think it provides a more interactive way of learning, people would be more engaged and more likely to learn with a hands on experience than a screen. Cost might be a factor as it is most likely expensive compared to a tablet or computer. ",positive
R_1efVMveFQleVFiq,"Yes, I do think this will be a replacement in some capacity. I believe this more ""hands-on"" approach serves to help many students learn more effectively. I believe the cost will be a huge barrier to the full replacement of screen-based learning, however. ",positive
R_3effLHLpIa8DsS6,"Of course, technology has come to replace computers, cell phones and even people.",positive
R_6iKeCT50peQs9Lf,"Very much so, that seems like a probable outcome given that AI functions like ChatGPT aids students in learning. Chess is a game of logic so a robot could replace screen-based computers and add value in demonstrating where to move the chess pieces. ",positive
R_7n0YAlUNpn9XSsc,Learning a variety of games is likely to make fewer mistakes than a human playing chess.,neutral
R_6zhJujjkQdtrhpT,"I don't think a physical robot will be needed, it's much easier and simpler to have AI integrated in some digital format where the user can interact with some interface and have an AI assistant explaining moves like done in the video.",negative
R_6nxgtsv4zEeZ3EH,"yes. in ten years to come,robot will be more advanced",positive
R_1V7NdmfTI9tmtBN,"I don't think they will replace them, but I think they could become more popular. It would still take a long time to fine tune all of the uses of the robot and to encourage people to switch to the new technology.",negative
R_7gNSth5y2PrzjHg,"It depends on how more intelligent they will become, more like a human ",neutral
R_2BtUkqKxKLbdAaX,i think so because the robot is explaing with pratical and with the way AI is going the robot can replace existing based computers,positive
R_7HzPI87ILy3LO0H,"Robots are able to analyze data better than humans, so it would seem likely they could engage in lessons professionally and properly. ",positive
R_2kumFR7bXoo5k2J,No. Definitely not. Robots are invading society.,negative
R_3GK9MAuCRSp8GkS,Yes and i say that because it would become something normal,positive
R_8cUBTXrjeEqbwfD,"They could be effective because it was more realistic to have them move the pieces on the board, rather than simply watching a digital board on a screen.",positive
R_8Hk1ZYuWBC6z3dF,"No, they can seem intimidating to those who do not have regular exposure to them.",negative
R_2ozlRcIZoDwzO38,Yes I  believe that in ten years time the Robot  could replace exist existing screen based computrr,positive
R_41lLSiE3YjXdIad,Definitely possible to replace existing as it give a person a real life chance again someone as practice without the need for humans  ,positive
